{
  "stage_id": "00_research",
  "owning_agent": "researcher",
  "schema_ref": "schemas/00_research.json",
  "output_format": "json",
  "max_options": 1,
  "max_retries": 3,
  "antonio_gulli_patterns": ["Ch. 5 Tool Use", "Ch. 10 MCP", "Ch. 14 RAG"],
  "claude_code_book_chapters": ["Ch. 5 MCP", "Ch. 8 Prompt Craft"],
  "helpers": {
    "fixtures":   ".claude/skills/00-research/fixtures/",
    "templates":  ".claude/skills/00-research/templates/",
    "scripts":    ".claude/skills/00-research/scripts/",
    "examples":   ".claude/skills/00-research/examples/",
    "rubric":     ".claude/skills/00-research/rubric.md",
    "eval_cases": ".claude/skills/00-research/eval-cases.md"
  },
  "input_schema": {
    "fields": [
      {"name": "input_id", "type": "string (8 hex)", "required": true, "source": "hcom message from @orch"},
      {"name": "input_ref", "type": "string (path/URL/topic)", "required": true, "source": "hcom message from @orch"},
      {"name": "depth", "type": "enum: shallow|medium|deep", "required": true, "source": "--depth CLI flag (default medium)"}
    ],
    "hcom_message_example": "hcom send --name <sender> \"@research-pipeline-claude-8 research: <input_id> depth=medium; files=schemas/00_research.json; description=...\""
  },
  "process": [
    {"step": 1, "type": "llm", "description": "Read hcom message. Extract input_id, input_ref, depth."},
    {"step": 2, "type": "deterministic", "description": "Compute subject. Topic string -> use as-is. Otherwise call tools.fetch_input.fetch() and extract main subject in 1-2 sentences."},
    {"step": 3, "type": "llm", "description": "Look up depth params (shallow=1/3/5, medium=2/5/10, deep=3/3-5/15)."},
    {"step": 4, "type": "llm", "description": "Round 1: generate N initial queries (definition, current state, key players, recent developments, criticism). Record each in queries[] with round: 1 + rationale."},
    {"step": 5, "type": "deterministic", "description": "For each query: call WebSearch. Collect URLs. Dedupe by URL across the round."},
    {"step": 6, "type": "llm", "description": "For each top URL: call WebFetch, extract 200-500 char excerpt, append to sources[] with url, title, excerpt, fetched_at, relevance."},
    {"step": 7, "type": "llm", "description": "If not last round: identify gaps, generate follow-up queries, run another round. Do NOT re-fetch URLs."},
    {"step": 8, "type": "llm", "description": "Write synthesis (500-2000 word integrated summary with [N] inline citations)."},
    {"step": 9, "type": "llm", "description": "Write key_findings (3-7 bullets) + gaps (1-3 honest limitations)."},
    {"step": 10, "type": "deterministic", "description": "Assemble JSON matching schemas/00_research.json. Write via write_artifact + write_meta.", "code_block": "from tools.artifact_io import build_meta, write_meta, write_artifact, next_version\nv = next_version(input_id, '00_research')\nwrite_artifact(input_id, '00_research', v, dossier_json, ext='json')\nmeta = build_meta(stage='00_research', input_id=input_id, version=v, producer='researcher', parent_ref=str(input_ref))\nwrite_meta(input_id, '00_research', v, meta)"},
    {"step": 11, "type": "deterministic", "description": "Ping @critic with validate: <input_id> 00_research."}
  ],
  "output_schema": {
    "required_fields": ["topic", "depth", "queries", "sources", "synthesis"],
    "template": {
      "topic": "<one sentence, specific>",
      "depth": "medium",
      "queries": [{"query": "<the search query>", "round": 1, "rationale": "<why this angle>", "results_count": 8}],
      "sources": [{"url": "https://example.com/page", "title": "<page title>", "fetched_at": "2026-06-01T12:00:00Z", "excerpt": "<200-500 char excerpt>", "relevance": "high"}],
      "synthesis": "<500-2000 word integrated summary with [1], [2] citations>",
      "key_findings": ["<most important takeaway 1>"],
      "gaps": ["<honest limitation 1>"]
    }
  },
  "examples": [
    {
      "source": "scripts/smoke_v2.py:18-45",
      "lifted_from": "real example for the 'Quantum error correction 2026' topic",
      "artifact": {
        "topic": "Quantum error correction 2026",
        "depth": "medium",
        "queries": [
          {"query": "quantum error correction 2026 advances", "round": 1, "rationale": "broad scoping", "results_count": 8},
          {"query": "surface code threshold recent papers", "round": 2, "rationale": "gap from round 1", "results_count": 5}
        ],
        "sources": [
          {"url": "https://example.com/qec-review-2026", "title": "QEC Review 2026", "fetched_at": "2026-06-01T12:00:00Z", "excerpt": "Surface codes remain dominant; logical qubit counts crossed 1000 in 2026.", "relevance": "high"}
        ],
        "synthesis": "Quantum error correction matured significantly in 2026. Surface codes dominate due to their high threshold (~1%) and planar geometry. Google's Condor demonstrated below-threshold operation with 1000+ logical qubits [1].",
        "key_findings": ["Surface codes crossed the 1000 logical qubit milestone in 2026", "Below-threshold operation now routine for d=5 to d=11"],
        "gaps": ["Limited public data on long-term logical qubit stability"]
      }
    }
  ],
  "self_check": [
    {"step": 1, "check": "All required fields present (topic, depth, queries, sources, synthesis)"},
    {"step": 2, "check": "depth enum is shallow|medium|deep"},
    {"step": 3, "check": "queries[] non-empty; each has query (minLength 1) + round (integer >=1)"},
    {"step": 4, "check": "Each source has url (uri format), title, excerpt (minLength 1)"},
    {"step": 5, "check": "Every [N] in synthesis resolves to a 1-based index in sources[]"},
    {"step": 6, "check": "topic is one sentence, specific"},
    {"step": 7, "check": "Round 1 queries are diverse (not 5 variants of the same phrase)"},
    {"step": 8, "check": "Sources weighted: relevance: high only for actually-cited sources"},
    {"step": 9, "check": "synthesis reads as one piece (not stapled per-source paragraphs)"},
    {"step": 10, "check": "gaps are honest"},
    {"step": 11, "check": "v1.meta.json written even for shallow / 1-source case"},
    {"step": 12, "check": "@critic pinged with validate: <input_id> 00_research"}
  ],
  "validation": {
    "check_refs": ["validation/02-post-execution-completeness.md", "validation/03-llm-judge.md"],
    "threshold": 0.7,
    "common_failures": [
      {"failure": "synthesis empty or minLength: 1 violated", "fix": "Write at least 500 words, add inline citations"},
      {"failure": "queries empty (minItems: 1 violated)", "fix": "Generate at least 1 query"},
      {"failure": "[N] citation doesn't resolve to sources[] index", "fix": "Re-number or add the missing source"},
      {"failure": "LLM-judge scores < 0.7 (queries too narrow, synthesis reads as a list)", "fix": "Re-write with broader queries + connected prose"}
    ]
  },
  "failure_modes": [
    {"name": "WebSearch returns 0 results", "handling": "Record the query with results_count: 0, try a reformulation, note in gaps."},
    {"name": "WebFetch times out / 4xx / 5xx", "handling": "Skip that URL, retry <=1, note in gaps if it was a key source."},
    {"name": "Topic is ambiguous (e.g. 'transformers')", "handling": "Pick most likely subject from search-result context, record disambiguation in gaps."},
    {"name": "All sources are low-quality (SEO spam)", "handling": "Still produce the dossier; flag source-quality concern in gaps."}
  ],
  "refactor_delta": {
    "scope": "Small",
    "current_state": "12-step process + quality bar + failure modes live in this spec's Process + Self-check + Failure-modes sections.",
    "target_state": "All process detail stays in this spec; the researcher's JSON contract is the only agent truth.",
    "concrete_steps": [
      "Keep the 12-step process + quality bar in this spec (already moved).",
      "Add minItems: 3 to schemas/00_research.json#key_findings and maxItems: 3 to #gaps (per the prose rules).",
      "Add maxLength: 5000 to schemas/00_research.json#synthesis (currently unbounded).",
      "Move the depth-parameters table into this spec's Identity section."
    ]
  }
}
